{
  "$schema": "./catalog.schema.json",
  "catalogVersion": "1",
  "framework": {
    "groupId": "io.americanexpress.synapse",
    "frameworkVersion": "0.4.28-SNAPSHOT",
    "java": "21",
    "springBoot": "3.5.x",
    "jakarta": true,
    "loggingFacade": "org.slf4j.ext.XLogger (XLoggerFactory.getXLogger), use logger.entry()/exit()"
  },
  "notes": [
    "Build each operation by extending a Base*Controller + Base*Service pair; override the protected abstract execute* method, not the public method.",
    "Two parallel imperative families exist. PREFER 'service.rest' (granular execute* methods) used by all samples. The 'api.rest.imperative' family (unified BaseService<I,O>.execute) is newer/experimental; do not mix the two. See docs/agent/RECOMMENDATIONS.md #2.",
    "BaseServiceRequest is an INTERFACE (implements). BaseServiceResponse is an abstract class with a String id (extends).",
    "Reads are POST-with-body at /inquiry_results (one) and /multiple_results (many); only get-by-id is a real GET /{id}.",
    "Synapse provides NO base repository: repositories extend Spring Data JpaRepository<Entity, Long> directly.",
    "Never write a @RestControllerAdvice: importing the layer config registers ControllerExceptionHandler automatically."
  ],
  "families": {
    "imperativeRest": {
      "basePackage": "io.americanexpress.synapse.service.rest",
      "artifact": "synapse-service-rest",
      "appConfig": {
        "import": "io.americanexpress.synapse.service.rest.config.ServiceRestConfig",
        "pattern": "@Configuration @PropertySource(\"classpath:<app>.properties\") @ComponentScan(basePackages=\"<app.pkg>\") @Import({<YourDataConfig>.class, ServiceRestConfig.class})"
      },
      "models": {
        "request": { "type": "io.americanexpress.synapse.service.rest.model.BaseServiceRequest", "kind": "interface", "use": "implements", "validation": "jakarta.validation.constraints on fields; @Valid enforced by base controller" },
        "response": { "type": "io.americanexpress.synapse.service.rest.model.BaseServiceResponse", "kind": "abstract class", "use": "extends", "inherits": "String id (getId/setId)" },
        "paginatedRequest": { "type": "io.americanexpress.synapse.service.rest.model.BasePaginatedServiceRequest", "use": "implements/extends for poly reads", "carries": "PageInformation{int page,int size}" }
      },
      "operations": [
        {
          "id": "create",
          "httpMethod": "POST",
          "path": "",
          "successStatus": 201,
          "controller": { "class": "BaseCreateController", "generics": "<I extends BaseServiceRequest, O extends BaseServiceResponse, S extends BaseCreateService<I,O>>" },
          "service": { "class": "BaseCreateService", "generics": "<I extends BaseServiceRequest, O extends BaseServiceResponse>", "override": "protected O executeCreate(HttpHeaders headers, I request)" }
        },
        {
          "id": "readMono",
          "httpMethod": "POST",
          "path": "/inquiry_results",
          "successStatus": 200,
          "controller": { "class": "BaseReadMonoController", "generics": "<I extends BaseServiceRequest, O extends BaseServiceResponse, S extends BaseReadMonoService<I,O>>" },
          "service": { "class": "BaseReadMonoService", "generics": "<I extends BaseServiceRequest, O extends BaseServiceResponse>", "override": "protected O executeRead(HttpHeaders headers, I request)" }
        },
        {
          "id": "readPoly",
          "httpMethod": "POST",
          "path": "/multiple_results",
          "successStatus": 200,
          "returns": "List<O> (service returns Page<O>)",
          "controller": { "class": "BaseReadPolyController", "generics": "<I extends BaseServiceRequest, O extends BaseServiceResponse, S extends BaseReadPolyService<I,O>>" },
          "service": { "class": "BaseReadPolyService", "generics": "<I extends BaseServiceRequest, O extends BaseServiceResponse>", "override": "protected org.springframework.data.domain.Page<O> executeRead(HttpHeaders headers, I request)" }
        },
        {
          "id": "getMono",
          "httpMethod": "GET",
          "path": "/{id}",
          "successStatus": 200,
          "note": "Get-by-id; service generic carries only <O>, reads by String identifier.",
          "controller": { "class": "BaseGetMonoController", "generics": "<O extends BaseServiceResponse, S extends BaseGetMonoService<O>>" },
          "service": { "class": "BaseGetMonoService", "generics": "<O extends BaseServiceResponse>", "override": "protected O executeRead(HttpHeaders headers, String identifier)" }
        },
        {
          "id": "update",
          "httpMethod": "PUT",
          "path": "",
          "successStatus": 204,
          "note": "Controller returns void; service generic carries only <I>.",
          "controller": { "class": "BaseUpdateController", "generics": "<I extends BaseServiceRequest, S extends BaseUpdateService<I>>" },
          "service": { "class": "BaseUpdateService", "generics": "<I extends BaseServiceRequest>", "override": "protected void executeUpdate(HttpHeaders headers, I request)" }
        },
        {
          "id": "delete",
          "httpMethod": "DELETE",
          "path": "/{identifier}",
          "successStatus": 204,
          "controller": { "class": "BaseDeleteController", "generics": "<S extends BaseDeleteService>" },
          "service": { "class": "BaseDeleteService", "generics": "(none)", "override": "protected void executeDelete(HttpHeaders headers, String identifier)" }
        }
      ]
    },
    "reactiveRest": {
      "basePackage": "io.americanexpress.synapse.service.reactive.rest",
      "artifact": "synapse-service-reactive-rest",
      "appConfig": {
        "extends": "io.americanexpress.synapse.service.reactive.rest.config.BaseServiceReactiveRestConfig",
        "pattern": "@Configuration @EnableWebFlux(via base) class AppConfig extends BaseServiceReactiveRestConfig { AppConfig(ObjectMapper m){ super(m);} }",
        "note": "Reactive models live in io.americanexpress.synapse.service.reactive.rest.model (own BaseServiceRequest interface + BaseServiceResponse abstract)."
      },
      "operations": [
        { "id": "create", "httpMethod": "POST", "path": "", "successStatus": 201, "controller": { "class": "BaseCreateReactiveController", "generics": "<I,O,S extends BaseCreateReactiveService<I,O>>" }, "service": { "class": "BaseCreateReactiveService", "override": "protected Mono<O> executeCreate(HttpHeaders headers, I request)" } },
        { "id": "getMono", "httpMethod": "GET", "path": "/{id}", "controller": { "class": "BaseGetMonoReactiveController", "generics": "<O,S extends BaseGetMonoReactiveService<O>>" }, "service": { "class": "BaseGetMonoReactiveService", "override": "protected Mono<O> executeRead(HttpHeaders headers, String request)" } },
        { "id": "getFlux", "httpMethod": "GET", "path": "", "returns": "Flux<O>", "controller": { "class": "BaseGetFluxReactiveController", "generics": "<O,S extends BaseGetFluxReactiveService<O>>" }, "service": { "class": "BaseGetFluxReactiveService", "override": "protected Flux<O> executeRead(HttpHeaders headers)" } },
        { "id": "readMono", "httpMethod": "POST", "path": "/inquiry_results", "controller": { "class": "BaseReadMonoReactiveController", "generics": "<I,O,S extends BaseReadMonoReactiveService<I,O>>" }, "service": { "class": "BaseReadMonoReactiveService", "override": "protected Mono<O> executeRead(HttpHeaders headers, I request)" } },
        { "id": "readFlux", "httpMethod": "POST", "path": "/multiple_results", "returns": "ResponseEntity<Flux<O>>", "controller": { "class": "BaseReadFluxReactiveController", "generics": "<I,O,S extends BaseReadFluxReactiveService<I,O>>" }, "service": { "class": "BaseReadFluxReactiveService", "override": "protected Flux<O> executeRead(HttpHeaders headers, I request)" } },
        { "id": "update", "httpMethod": "PUT", "path": "", "successStatus": 204, "controller": { "class": "BaseUpdateReactiveController", "generics": "<I,S extends BaseUpdateReactiveService<I>>" }, "service": { "class": "BaseUpdateReactiveService", "override": "protected Mono<Void> executeUpdate(HttpHeaders headers, I request)" } },
        { "id": "delete", "httpMethod": "DELETE", "path": "/{identifier}", "successStatus": 204, "controller": { "class": "BaseDeleteReactiveController", "generics": "<S extends BaseDeleteReactiveService>" }, "service": { "class": "BaseDeleteReactiveService", "override": "protected Mono<Void> executeDelete(HttpHeaders headers, String identifier)" } }
      ]
    },
    "data": {
      "baseEntity": {
        "jpa": {
          "class": "io.americanexpress.synapse.data.jpa.entity.BaseEntity",
          "artifact": "synapse-data-jpa",
          "annotations": ["@MappedSuperclass", "@EntityListeners(AuditingEntityListener.class)"],
          "id": "Long id @Id @GeneratedValue(strategy=GenerationType.IDENTITY)",
          "auditFields": "Instant createdDateTime(created_date_time), Instant lastModifiedDateTime(last_modified_date_time), String createdBy(created_by), String lastModifiedBy(last_modified_by), Long version(@Version)",
          "use": "@Entity @Table(name=\"...\") public class XEntity extends BaseEntity"
        },
        "mongodb": { "class": "io.americanexpress.synapse.data.mongodb.entity.BaseEntity", "artifact": "synapse-data-mongodb", "id": "String (subclass adds @Id)", "auditFields": "LocalDateTime created/lastModified, String createdBy/lastModifiedBy, Long version", "note": "Different id + timestamp types than JPA — do not cross imports." },
        "jdbc": { "class": "io.americanexpress.synapse.data.jdbc.entity.BaseEntity", "artifact": "synapse-data-jdbc", "id": "Long (Spring Data JDBC @Id)", "note": "Spring Data Relational @Column, no ORM." }
      },
      "repository": {